codigo,descricao,la,outros_documentos
33.19-8-00,Manutenção e reparação de equipamentos e produtos não especificados anteriormente,Sim,-
33.12-1-02,"Manutenção e reparação de aparelhos e instrumentos de medida, teste e controle",Sim,-
33.12-1-04,Manutenção e reparação de equipamentos e instrumentos ópticos,Sim,-
33.13-9-01,"Manutenção e reparação de geradores, transformadores e motores elétricos",Sim,-
33.13-9-99,"Manutenção e reparação de máquinas, aparelhos e materiais elétricos não especificados anteriormente",Sim,-
33.14-7-01,Manutenção e reparação de máquinas motrizes não elétricas,Sim,-
33.14-7-02,"Manutenção e reparação de equipamentos hidráulicos e pneumáticos, exceto válvulas",Sim,-
33.14-7-03,Manutenção e reparação de válvulas industriais,Não,-
33.14-7-04,Manutenção e reparação de compressores,Não,-
33.14-7-09,"Manutenção e reparação de máquinas de escrever, calcular e de outros equipamentos não eletrônicos para escritório",Não,-
33.21-0-00,Instalação de máquinas e equipamentos industriais,Não,-
33.29-5-01,Serviços de montagem de móveis de qualquer material,Não,-
33.29-5-99,Instalação de outros equipamentos não especificados anteriormente,Não,-
33.12-1-03,Manutenção e reparação de aparelhos eletromédicos e eletroterapêuticos e equipamentos de irradiação,Sim,-
33.14-7-12,Manutenção e reparação de tratores agrícolas,Sim,-
33.14-7-16,"Manutenção e reparação de tratores, exceto agrícolas",Sim,-
33.15-5-00,Manutenção e reparação de veículos ferroviários,Sim,-
33.16-3-01,"Manutenção e reparação de aeronaves, exceto a manutenção na pista",Sim,-
33.16-3-02,Manutenção de aeronaves na pista,Sim,-
33.17-1-01,Manutenção e reparação de embarcações e estruturas flutuantes,Sim,-
33.17-1-02,Manutenção e reparação de embarcações para esporte e lazer,Sim,-
35.11-5-01,Geração de energia elétrica,Sim,-
35.11-5-02,Atividades de coordenação e controle da operação da geração e transmissão de energia elétrica,Não,-
35.12-3-00,Transmissão de energia elétrica,Sim,-
35.14-0-00,Distribuição de energia elétrica,Sim,-
35.13-1-00,Comércio atacadista de energia elétrica,Sim,-
35.30-1-00,"Produção e distribuição de vapor, água quente e ar condicionado",Não,-
35.20-4-01,Produção de gás; processamento de gás natural,Sim,-
35.20-4-02,Distribuição de combustíveis gasosos por redes urbanas,Sim,-
36.00-6-01,"Captação, tratamento e distribuição de água",Sim,-
36.00-6-02,Distribuição de água por caminhões,Não,-
37.01-1-00,Gestão de redes de esgoto,Sim,-
37.02-9-00,"Atividades relacionadas a esgoto, exceto a gestão de redes",Sim,-
38.11-4-00,Coleta de resíduos não perigosos,Sim,-
38.12-2-00,Coleta de resíduos perigosos,Sim,-
38.21-1-00,Tratamento e disposição de resíduos não perigosos,Sim,-
38.22-0-00,Tratamento e disposição de resíduos perigosos,Sim,-
38.31-9-01,Recuperação de sucatas de alumínio,Sim,-
38.31-9-99,"Recuperação de materiais metálicos, exceto alumínio",Sim,-
38.32-7-00,Recuperação de materiais plásticos,Sim,-
38.39-4-01,Usinas de compostagem,Sim,-
38.39-4-99,Recuperação de materiais não especificados anteriormente,Sim,-
39.00-5-00,Descontaminação e outros serviços de gestão de resíduos,Sim,-
41.10-7-00,Incorporação de empreendimentos imobiliários,Não,*** Se for SPE: Contrato de compra e venda ou permuta do terreno. Matrícula atualizada;
41.20-4-00,Construção de edifícios,Não,*** Se for SPE: Contrato de compra e venda ou permuta do terreno. Matrícula atualizada;
42.11-1-01,Construção de rodovias e ferrovias,Não,-
42.11-1-02,Pintura para sinalização em pistas rodoviárias e aeroportos,Não,-
42.12-0-00,Construção de obras de arte especiais,Não,-
42.13-8-00,"Obras de urbanização - ruas, praças e calçadas",Não,-
42.21-9-01,Construção de barragens e represas para geração de energia  elétrica,Sim,-
42.21-9-02,Construção de estações e redes de distribuição de energia elétrica,Sim,-
42.21-9-03,Manutenção de redes de distribuição de energia elétrica,Não,-
42.21-9-04,Construção de estações e redes de telecomunicações,Não,-
42.21-9-05,Manutenção de estações e redes de telecomunicações,Não,-
42.22-7-01,"Construção de redes de abastecimento de água, coleta de esgoto e construções correlatas, exceto obras de irrigação",Sim,-
42.22-7-02,Obras de irrigação,Não,-
42.23-5-00,"Construção de redes de transportes por dutos, exceto para água e esgoto",Sim,-
42.91-0-00,"Obras portuárias, marítimas e fluviais",Não,-
42.92-8-01,Montagem de estruturas metálicas,Não,-
42.92-8-02,Obras de montagem industrial,Não,-
42.99-5-01,Construção de instalações esportivas e recreativas,Não,-
42.99-5-99,Outras obras de engenharia civil não especificadas anteriormente,Não,-
43.11-8-01,Demolição de edifícios e outras estruturas,Não,-
43.11-8-02,Preparação de canteiro e limpeza de terreno,Não,-
43.12-6-00,Perfurações e sondagens,Não,-
43.13-4-00,Obras de terraplenagem,Sim,-
43.19-3-00,Serviços de preparação do terreno não especificados anteriormente,Não,-
43.21-5-00,Instalação e manutenção elétrica,Não,-
43.22-3-01,"Instalações hidráulicas, sanitárias e de gás",Não,-
43.22-3-02,"Instalação e manutenção de sistemas centrais de ar condicionado, de ventilação e refrigeração",Não,-
43.22-3-03,Instalações de sistema de prevenção contra incêndio,Não,-
43.29-1-01,Instalação de painéis publicitários,Não,-
43.29-1-02,"Instalação de equipamentos para orientação à navegação marítima, fluvial e lacustre",Não,-
43.29-1-03,"Instalação, manutenção e reparação de elevadores, escadas e esteiras rolantes",Não,-
43.29-1-04,"Montagem e instalação de sistemas e equipamentos de iluminação e sinalização em vias públicas, portos e aeroportos",Não,-
43.29-1-05,"Tratamentos térmicos, acústicos ou de vibração",Não,-
43.29-1-99,Outras obras de instalações em construções não especificadas anteriormente,Não,-
43.30-4-01,Impermeabilização em obras de engenharia civil,Não,-
43.30-4-02,"Instalação de portas, janelas, tetos, divisórias e armários embutidos de qualquer material",Não,-
43.30-4-03,Obras de acabamento em gesso e estuque,Não,-
43.30-4-04,Serviços de pintura de edifícios em geral,Não,-
43.30-4-05,Aplicação de revestimentos e de resinas em interiores e exteriores,Não,-
43.30-4-99,Outras obras de acabamento da construção,Não,-
43.91-6-00,Obras de fundações,Não,-
43.99-1-01,Administração de obras,Não,-
43.99-1-02,Montagem e desmontagem de andaimes e outras estruturas temporárias,Não,-
43.99-1-03,Obras de alvenaria,Não,-
43.99-1-04,Serviços de operação e fornecimento de equipamentos para transporte e elevação de cargas e pessoas para uso em obras,Não,-
43.99-1-05,Perfuração e construção de poços de água,Não,-
43.99-1-99,Serviços especializados para construção não especificados anteriormente,Não,-
45.11-1-01,"Comércio a varejo de automóveis, camionetas e utilitários novos",Não,-
45.11-1-02,"Comércio a varejo de automóveis, camionetas e utilitários usados",Não,-
45.11-1-03,"Comércio por atacado de automóveis, camionetas e utilitários novos e usados",Não,-
45.11-1-04,Comércio por atacado de caminhões novos e usados,Não,-
45.11-1-05,Comércio por atacado de reboques e semireboques novos e usados,Não,-
45.11-1-06,Comércio por atacado de ônibus e micro-ônibus novos e usados,Não,-
45.12-9-02,Comércio sob consignação de veículos automotores,Não,-
45.20-0-03,Serviços de manutenção e reparação elétrica de veículos automotores,Sim,-
45.20-0-04,Serviços de alinhamento e balanceamento de veículos automotores,Sim,-
45.20-0-07,"Serviços de instalação, manutenção e reparação de acessórios para veículos automotores",Sim,-
45.20-0-08,Serviços de capotaria,Não,-
45.30-7-01,Comércio por atacado de peças e acessórios novos para veículos automotores,Não,-
45.30-7-03,Comércio a varejo de peças e acessórios novos para veículos automotores,Não,-
45.41-2-01,Comércio por atacado de motocicletas e motonetas,Não,-
45.41-2-02,Comércio por atacado de peças e acessórios para motocicletas e motonetas,Não,-
45.41-2-03,Comércio a varejo de motocicletas e motonetas novas,Não,-
45.41-2-04,Comércio a varejo de motocicletas e motonetas usadas,Não,-
45.41-2-06,Comércio a varejo de peças e acessórios novos para motocicletas e motonetas,Não,-
45.41-2-07,Comércio a varejo de peças e acessórios usados para motocicletas e motonetas,Não,-
45.42-1-02,Comércio sob consignação de motocicletas e motonetas,Não,-
45.12-9-01,Representantes comerciais e agentes do comércio de veículos automotores,Não,-
45.30-7-06,Representantes comerciais e agentes do comércio de peças e acessórios novos e usados para veículos automotores,Não,-
45.42-1-01,"Representantes comerciais e agentes do comércio de motocicletas e motonetas, peças e acessórios",Não,-
45.20-0-01,Serviços de manutenção e reparação mecânica de veículos automotores,Sim,-
45.20-0-02,Serviços de lanternagem ou funilaria e pintura de veículos automotores,Sim,-
45.20-0-05,"Serviços de lavagem, lubrificação e polimento de veículos automotores",Sim,-
45.20-0-06,Serviços de borracharia para veículos automotores,Sim,-
45.30-7-02,Comércio por atacado de pneumáticos e câmaras-de-ar,Não,-
45.30-7-04,Comércio a varejo de peças e acessórios usados para veículos automotores,Sim,-
45.30-7-05,Comércio a varejo de pneumáticos e câmaras-de-ar,"Sim***",Verificar se não é borracharia. Caso seja pedir LA
45.43-9-00,Manutenção e reparação de motocicletas e motonetas,Sim,-
46.11-7-00,Representantes comerciais e agentes do comércio de matérias-primas agrícolas e animais vivos,Não,-
46.12-5-00,"Representantes comerciais e agentes do comércio de combustíveis, minerais, produtos siderúrgicos e químicos",Não,-
46.13-3-00,"Representantes comerciais e agentes do comércio de madeira, material de construção e ferragens",Não,-
46.14-1-00,"Representantes comerciais e agentes do comércio de máquinas, equipamentos, embarcações e aeronaves",Não,-
46.15-0-00,"Representantes comerciais e agentes do comércio de eletrodomésticos, móveis e artigos de uso doméstico",Não,-
46.16-8-00,"Representantes comerciais e agentes do comércio de têxteis, vestuário, calçados e artigos de viagem",Não,-
46.17-6-00,"Representantes comerciais e agentes do comércio de produtos alimentícios, bebidas e fumo",Não,-
46.18-4-01,"Representantes comerciais e agentes do comércio de medicamentos, cosméticos e produtos de perfumaria",Não,-
46.18-4-02,Representantes comerciais e agentes do comércio de instrumentos e materiais odonto-médico-hospitalares,Não,-
46.18-4-03,"Representantes comerciais e agentes do comércio de jornais, revistas e outras publicações",Não,-
46.18-4-99,Outros representantes comerciais e agentes do comércio especializado em produtos não especificados anteriormente,Não,-
46.19-2-00,Representantes comerciais e agentes do comércio de mercadorias em geral não especializado,Não,-
46.21-4-00,Comércio atacadista de café em grão,Não,-
46.22-2-00,Comércio atacadista de soja,Não,-
46.23-1-05,Comércio atacadista de cacau,Não,-
46.31-1-00,Comércio atacadista de leite e laticínios,Não,-
46.32-0-01,Comércio atacadista de cereais e leguminosas beneficiados,Não,-
46.32-0-02,"Comércio atacadista de farinhas, amidos e féculas",Não,-
46.32-0-03,"Comércio atacadista de cereais e leguminosas beneficiados, farinhas, amidos e féculas, com atividade de fracionamento e acondicionamento associada",Não,-
46.33-8-01,"Comércio atacadista de frutas, verduras, raízes, tubérculos, hortaliças e legumes frescos",Não,-
46.35-4-01,Comércio atacadista de água mineral,Não,-
46.35-4-02,"Comércio atacadista de cerveja, chope e refrigerante",Não,-
46.35-4-03,Comércio atacadista de bebidas com atividade de fracionamento e acondicionamento associada,Não,-
46.35-4-99,Comércio atacadista de bebidas não especificadas anteriormente,Não,-
46.37-1-01,"Comércio atacadista de café torrado, moído e solúvel",Não,-
46.37-1-02,Comércio atacadista de açúcar,Não,-
46.37-1-03,Comércio atacadista de óleos e gorduras,Não,-
46.37-1-04,"Comércio atacadista de pães, bolos, biscoitos e similares",Não,-
46.37-1-05,Comércio atacadista de massas alimentícias,Sim,-
46.37-1-06,Comércio atacadista de sorvetes,Não,-
46.37-1-07,"Comércio atacadista de chocolates, confeitos, balas, bombons e semelhantes",Não,-
46.37-1-99,Comércio atacadista especializado em outros produtos alimentícios não especificados anteriormente,Sim,-
46.39-7-01,Comércio atacadista de produtos alimentícios em geral,Sim,-
46.39-7-02,"Comércio atacadista de produtos alimentícios em geral, com atividade de fracionamento e acondicionamento associada",Sim,-
46.86-9-02,Comércio atacadista de embalagens,Não,-
46.23-1-01,Comércio atacadista de animais vivos,Sim,-
46.23-1-08,Comércio atacadista de matérias-primas agrícolas com atividade de fracionamento e acondicionamento associada,Não,-
46.33-8-02,Comércio atacadista de aves vivas e ovos,Sim,-
46.33-8-03,Comércio atacadista de coelhos e outros pequenos animais vivos para alimentação,Sim,-
46.74-5-00,Comércio atacadista de cimento,Não,-
46.79-6-01,"Comércio atacadista de tintas, vernizes e similares",Não,-
46.79-6-04,Comércio atacadista especializado de materiais de construção não especificados anteriormente,Não,-
46.79-6-99,Comércio atacadista de materiais de construção em geral,Não,-
46.81-8-01,"Comércio atacadista de álcool carburante, biodiesel, gasolina e demais derivados de petróleo, exceto lubrificantes, não realizado por transportador retalhista (TRR)",Sim,Parecer da defesa civil. Ocupação bombeiros para especial - liquido/gas inflamavel/ combustivel
46.81-8-02,Comércio atacadista de combustíveis realizado por transportador retalhista (TRR),Sim,Parecer da defesa civil. Ocupação bombeiros para especial - liquido/gas inflamavel/ combustivel. Autorização ANP
46.81-8-03,"Comércio atacadista de combustíveis de origem vegetal, exceto álcool carburante",Sim,Parecer da defesa civil. Ocupação bombeiros para especial - liquido/gas inflamavel/ combustivel. Autorização ANP
46.81-8-04,Comércio atacadista de combustíveis de origem mineral em bruto,Sim,Parecer da defesa civil. Ocupação bombeiros para especial - liquido/gas inflamavel/ combustivel. Autorização ANP
46.81-8-05,Comércio atacadista de lubrificantes,Sim,-
46.82-6-00,Comércio atacadista de gás liquefeito de petróleo (GLP),Não,Ocupação bombeiro especial - M-8 ou M-9. Autortização ANP
46.83-4-00,"Comércio atacadista de defensivos agrícolas, adubos, fertilizantes e corretivos do solo",Não,-
46.84-2-01,Comércio atacadista de resinas e elastômeros,Não,-
46.84-2-02,Comércio atacadista de solventes,Não,-
46.84-2-99,Comércio atacadista de outros produtos químicos e petroquímicos não especificados anteriormente,Não,-
46.86-9-01,Comércio atacadista de papel e papelão em bruto,Não,-
46.87-7-01,Comércio atacadista de resíduos de papel e papelão,Sim,-
46.87-7-02,"Comércio atacadista de resíduos e sucatas não metálicos, exceto de papel e papelão",Sim,-
46.87-7-03,Comércio atacadista de resíduos e sucatas metálicos,Sim,-
46.23-1-02,"Comércio atacadista de couros, lãs, peles e outros subprodutos não comestíveis de origem animal",Não,-
46.23-1-03,Comércio atacadista de algodão,Não,-
46.23-1-04,Comércio atacadista de fumo em folha não beneficiado,Não,-
46.23-1-06,"Comércio atacadista de sementes, flores, plantas e gramas",Não,-
46.23-1-07,Comércio atacadista de sisal,Não,-
46.23-1-09,Comércio atacadista de alimentos para animais,Não,-
46.23-1-99,Comércio atacadista de matérias-primas agrícolas não especificadas anteriormente,Não,-
46.36-2-01,Comércio atacadista de fumo beneficiado,Não,-
46.36-2-02,"Comércio atacadista de cigarros, cigarrilhas e charutos",Não,-
46.41-9-01,Comércio atacadista de tecidos,Não,-
46.41-9-02,"Comércio atacadista de artigos de cama, mesa e banho",Não,-
46.41-9-03,Comércio atacadista de artigos de armarinho,Não,-
46.42-7-01,"Comércio atacadista de artigos do vestuário e acessórios, exceto profissionais e de segurança",Não,-
46.42-7-02,Comércio atacadista de roupas e acessórios para uso profissional e de segurança do trabalho,Não,-
46.43-5-01,Comércio atacadista de calçados,Não,-
46.43-5-02,"Comércio atacadista de bolsas, malas e artigos de viagem",Não,-
46.44-3-01,Comércio atacadista de medicamentos e drogas de uso humano,Não,-
46.44-3-02,Comércio atacadista de medicamentos e drogas de uso veterinário,Não,-
46.45-1-01,"Comércio atacadista de instrumentos e materiais para uso médico, cirúrgico, hospitalar e de laboratórios",Não,-
46.45-1-02,Comércio atacadista de próteses e artigos de ortopedia,Não,-
46.45-1-03,Comércio atacadista de produtos odontológicos,Não,-
46.46-0-01,Comércio atacadista de cosméticos e produtos de perfumaria,Não,-
46.46-0-02,Comércio atacadista de produtos de higiene pessoal,Não,-
46.47-8-01,Comércio atacadista de artigos de escritório e de papelaria,Não,-
46.47-8-02,"Comércio atacadista de livros, jornais e outras publicações",Não,-
46.49-4-01,Comércio atacadista de equipamentos elétricos de uso pessoal e doméstico,Não,-
46.49-4-02,Comércio atacadista de aparelhos eletrônicos de uso pessoal e doméstico,Não,-
46.49-4-03,"Comércio atacadista de bicicletas, triciclos e outros veículos recreativos",Não,-
46.49-4-04,Comércio atacadista de móveis e artigos de colchoaria,Não,-
46.49-4-05,Comércio atacadista de artigos de tapeçaria; persianas e cortinas,Não,-
46.49-4-06,"Comércio atacadista de lustres, luminárias e abajures",Não,-
46.49-4-07,"Comércio atacadista de filmes, CDs, DVDs, fitas e discos",Não,-
46.49-4-08,"Comércio atacadista de produtos de higiene, limpeza e conservação domiciliar",Não,-
46.49-4-09,"Comércio atacadista de produtos de higiene, limpeza e conservação domiciliar, com atividade de fracionamento e acondicionamento associada",Não,-
46.49-4-10,"Comércio atacadista de jóias, relógios e bijuterias, inclusive pedras preciosas e semipreciosas lapidadas",Não,-
46.49-4-99,Comércio atacadista de outros equipamentos e artigos de uso pessoal e doméstico não especificados anteriormente,Não,-
46.51-6-01,Comércio atacadista de equipamentos de informática,Não,-
46.51-6-02,Comércio atacadista de suprimentos para informática,Não,-
46.52-4-00,Comércio atacadista de componentes eletrônicos e equipamentos de telefonia e comunicação,Não,-
46.61-3-00,"Comércio atacadista de máquinas, aparelhos e equipamentos para uso agropecuário; partes e peças",Não,-
46.62-1-00,"Comércio atacadista de máquinas, equipamentos para terraplenagem, mineração e construção; partes e peças",Não,-
46.63-0-00,Comércio atacadista de máquinas e equipamentos para uso industrial; partes e peças,Não,-
46.64-8-00,"Comércio atacadista de máquinas, aparelhos e equipamentos para uso odonto-médico-hospitalar; partes e peças",Não,-
46.65-6-00,Comércio atacadista de máquinas e equipamentos para uso comercial; partes e peças,Não,-
46.69-9-01,Comércio atacadista de bombas e compressores; partes e peças,Não,-
46.69-9-99,Comércio atacadista de outras máquinas e equipamentos não especificados anteriormente; partes e peças,Não,-
46.71-1-00,Comércio atacadista de madeira e produtos derivados,Não,-
46.72-9-00,Comércio atacadista de ferragens e ferramentas,Não,-
46.73-7-00,Comércio atacadista de material elétrico,Não,-
46.79-6-02,Comércio atacadista de mármores e granitos,Não,-
46.79-6-03,"Comércio atacadista de vidros, espelhos e vitrais",Não,-
46.85-1-00,"Comércio atacadista de produtos siderúrgicos e metalúrgicos, exceto para construção",Não,-
46.89-3-01,"Comércio atacadista de produtos da extração mineral, exceto combustíveis",Sim,Parecer da defesa civil. Ocupação bombeiros para especial - liquido/gas inflamavel/ combustivel. Autorização ANP
46.89-3-02,Comércio atacadista de fios e fibras beneficiados,Não,-
46.89-3-99,Comércio atacadista especializado em outros produtos intermediários não especificados anteriormente,Não,-
46.91-5-00,"Comércio atacadista de mercadorias em geral, com predominância de produtos alimentícios",Não,-
46.92-3-00,"Comércio atacadista de mercadorias em geral, com predominância de insumos agropecuários",Não,-
46.93-1-00,"Comércio atacadista de mercadorias em geral, sem predominância de alimentos ou de insumos agropecuários",Não,-
46.34-6-01,Comércio atacadista de carnes bovinas e suínas e derivados,Sim***,-
46.34-6-02,Comércio atacadista de aves abatidas e derivados,Não,-
46.34-6-03,Comércio atacadista de pescados e frutos do mar,Não,-
46.34-6-99,Comércio atacadista de carnes e derivados de outros animais,Não,-
47.11-3-01,"Comércio varejista de mercadorias em geral, com predominância de produtos alimentícios - hipermercados",Sim,-
47.11-3-02,"Comércio varejista de mercadorias em geral, com predominância de produtos alimentícios - supermercados",Sim,-
47.12-1-00,"Comércio varejista de mercadorias em geral, com predominância de produtos alimentícios - minimercados, mercearias e armazéns",Não,-
47.13-0-02,"Lojas de variedades, exceto lojas de departamentos ou magazines",Não,-
47.13-0-04,"Lojas de departamentos ou magazines, exceto lojas francas (Duty free)",Não,-
47.13-0-05,"Lojas francas (Duty Free) de aeroportos, portos e em fronteiras terrestres",Não,-
47.22-9-01,Comércio varejista de carnes - açougues,Sim,-
47.22-9-02,Peixaria,Sim,-
47.29-6-01,Tabacaria,Não,-
47.29-6-99,Comércio varejista de produtos alimentícios em geral ou especializado em produtos alimentícios não especificados anteriormente,Não,-
47.42-3-00,Comércio varejista de material elétrico,Não,-
47.43-1-00,Comércio varejista de vidros,Não,-
47.44-0-01,Comércio varejista de ferragens e ferramentas,Não,-
47.44-0-02,Comércio varejista de madeira e artefatos,Não,-
47.44-0-03,Comércio varejista de materiais hidráulicos,Não,-
47.44-0-04,"Comércio varejista de cal, areia, pedra britada, tijolos e telhas",Não,-
47.44-0-05,Comércio varejista de materiais de construção não especificados anteriormente,Não,-
47.44-0-06,Comércio varejista de pedras para revestimento,Não,-
47.44-0-99,Comércio varejista de materiais de construção em geral,Não,-
47.51-2-01,Comércio varejista especializado de equipamentos e suprimentos de informática,Não,-
47.51-2-02,Recarga de cartuchos para equipamentos de informática,Não,-
47.52-1-00,Comércio varejista especializado de equipamentos de telefonia e comunicação,Não,-
47.53-9-00,Comércio varejista especializado de eletrodomésticos e equipamentos de áudio e vídeo,Não,-
47.54-7-01,Comércio varejista de móveis,Não,-
47.54-7-02,Comércio varejista de artigos de colchoaria,Não,-
47.54-7-03,Comércio varejista de artigos de iluminação,Não,-
47.55-5-01,Comércio varejista de tecidos,Não,-
47.55-5-02,Comercio varejista de artigos de armarinho,Não,-
47.55-5-03,"Comercio varejista de artigos de cama, mesa e banho",Não,-
47.56-3-00,Comércio varejista especializado de instrumentos musicais e acessórios,Não,-
47.57-1-00,"Comércio varejista especializado de peças e acessórios para aparelhos eletroeletrônicos para uso doméstico, exceto informática e comunicação",Não,-
47.59-8-01,"Comércio varejista de artigos de tapeçaria, cortinas e persianas",Não,-
47.59-8-99,Comércio varejista de outros artigos de uso doméstico não especificados anteriormente,Não,-
47.61-0-01,Comércio varejista de livros,Não,-
47.61-0-02,Comércio varejista de jornais e revistas,Não,-
47.61-0-03,Comércio varejista de artigos de papelaria,Não,-
47.62-8-00,"Comércio varejista de discos, CDs, DVDs e fitas",Não,-
47.63-6-01,Comércio varejista de brinquedos e artigos recreativos,Não,-
47.63-6-02,Comércio varejista de artigos esportivos,Não,-
47.63-6-03,Comércio varejista de bicicletas e triciclos; peças e acessórios,Não,-
47.63-6-04,"Comércio varejista de artigos de caça, pesca e camping",Não,-
47.63-6-05,Comércio varejista de embarcações e outros veículos recreativos; peças e acessórios,Não,-
47.71-7-02,"Comércio varejista de produtos farmacêuticos, com manipulação de fórmulas",Não,-
47.71-7-03,Comércio varejista de produtos farmacêuticos homeopáticos,Não,-
47.71-7-04,Comércio varejista de medicamentos veterinários,Não,-
47.81-4-00,Comércio varejista de artigos do vestuário e acessórios,Não,-
47.82-2-01,Comércio varejista de calçados,Não,-
47.82-2-02,Comércio varejista de artigos de viagem,Não,-
47.83-1-01,Comércio varejista de artigos de joalheria,Não,-
47.83-1-02,Comércio varejista de artigos de relojoaria,Não,-
47.85-7-01,Comércio varejista de antiguidades,Não,-
47.85-7-99,Comércio varejista de outros artigos usados,Não,-
47.89-0-01,"Comércio varejista de suvenires, bijuterias e artesanatos",Não,-
47.89-0-02,Comércio varejista de plantas e flores naturais,Não,-
47.89-0-03,Comércio varejista de objetos de arte,Não,-
47.89-0-05,Comércio varejista de produtos saneantes domissanitários,Não,-
47.89-0-07,Comércio varejista de equipamentos para escritório,Não,-
47.89-0-08,Comércio varejista de artigos fotográficos e para filmagem,Não,-
47.89-0-99,Comércio varejista de outros produtos não especificados anteriormente,Não,-
