codigo,descricao,la,outros_documentos
47.21-1-02,Padaria e confeitaria com predominância de revenda,Não,-
47.21-1-03,Comércio varejista de laticínios e frios,Não,-
47.21-1-04,"Comércio varejista de doces, balas, bombons e semelhantes",Não,-
47.23-7-00,Comércio varejista de bebidas,Não,-
47.24-5-00,Comércio varejista de hortifrutigranjeiros,Não,-
47.29-6-02,Comércio varejista de mercadorias em lojas de conveniência,Não,-
47.71-7-01,"Comércio varejista de produtos farmacêuticos, sem manipulação de fórmulas",Não,-
47.72-5-00,"Comércio varejista de cosméticos, produtos de perfumaria e de higiene pessoal",Não,-
47.73-3-00,Comércio varejista de artigos médicos e ortopédicos,Não,-
47.74-1-00,Comércio varejista de artigos de óptica,Não,-
47.31-8-00,Comércio varejista de combustíveis para veículos automotores,Sim,Parecer da defesa civil. Ocupação bombeiros para especial - liquido/gas inflamavel/ combustivel. Autorização ANP
47.32-6-00,Comércio varejista de lubrificantes,Sim,-
47.41-5-00,Comércio varejista de tintas e materiais para pintura,Não,-
47.84-9-00,Comércio varejista de gás liqüefeito de petróleo (GLP),Não,Ocupação bombeiro especial - M-8 ou M-9. Autortização ANP
47.89-0-04,Comércio varejista de animais vivos e de artigos e alimentos para animais de estimação,Sim,-
47.89-0-06,Comércio varejista de fogos de artifício e artigos pirotécnicos,Não,Parecer da defesa civil. Ocupação bombeiros para ocupação explosiva
47.89-0-09,Comércio varejista de armas e munições,Não,"Autorização da PF. Se tiver portas abertas, bombeiros com ocupação de comércio de armas."
49.11-6-00,Transporte ferroviário de carga,Não,-
49.12-4-01,Transporte ferroviário de passageiros intermunicipal e interestadual,Não,-
49.12-4-02,Transporte ferroviário de passageiros municipal e em região metropolitana,Não,-
49.12-4-03,Transporte metroviário,Não,-
49.21-3-01,"Transporte rodoviário coletivo de passageiros, com itinerário fixo, municipal",Não,-
49.21-3-02,"Transporte rodoviário coletivo de passageiros, com itinerário fixo, intermunicipal em região metropolitana",Não,-
49.22-1-01,"Transporte rodoviário coletivo de passageiros, com itinerário fixo, intermunicipal, exceto em região metropolitana",Não,-
49.22-1-02,"Transporte rodoviário coletivo de passageiros, com itinerário fixo, interestadual",Não,-
49.22-1-03,"Transporte rodoviário coletivo de passageiros, com itinerário fixo, internacional",Não,-
49.23-0-01,Serviço de táxi,Não,Verificar documentos para autorização
49.24-8-00,Transporte escolar,Não,"Cópia carteira de habilitação do motorista (categoria D ou E). Certificado de conclusão do curso específico de condutores. Certidão de não ter cometido nenhuma infração grave ou gravíssima, ou ser reincidente em infrações médias, durante os últimos doze meses (do condutor). Certidão de bons antecedentes, civil e criminal do condutor. Seguro de passageiros e terceiros. Documento do veículo em nome do requerente"
49.30-2-03,Transporte rodoviário de produtos perigosos,Não,Parecer da defesa civil
49.40-0-00,Transporte dutoviário,Não,-
49.50-7-00,"Trens turísticos, teleféricos e similares",Não,-
49.23-0-02,Serviço de transporte de passageiros - locação de automóveis com motorista,Não,Verificar documentos para autorização
49.29-9-01,"Transporte rodoviário coletivo de passageiros, sob regime de fretamento, municipal",Não,-
49.29-9-02,"Transporte rodoviário coletivo de passageiros, sob regime de fretamento, intermunicipal, interestadual e internacional",Não,-
49.29-9-03,"Organização de excursões em veículos rodoviários próprios, municipal",Não,-
49.29-9-04,"Organização de excursões em veículos rodoviários próprios, intermunicipal, interestadual e internacional",Não,-
49.29-9-99,Outros transportes rodoviários de passageiros não especificados anteriormente,Não,-
49.30-2-01,"Transporte rodoviário de carga, exceto produtos perigosos e mudanças, municipal",Não,-
49.30-2-02,"Transporte rodoviário de carga, exceto produtos perigosos e mudanças, intermunicipal, interestadual e internacional",Não,-
49.30-2-04,Transporte rodoviário de mudanças,Não,-
50.11-4-01,Transporte marítimo de cabotagem - Carga,Não,Autorização da ANTAC.
50.11-4-02,Transporte marítimo de cabotagem - Passageiros,Não,Autorização da ANTAC.
50.12-2-01,Transporte marítimo de longo curso - Carga,Não,Autorização da ANTAC.
50.12-2-02,Transporte marítimo de longo curso - Passageiros,Não,Autorização da ANTAC.
50.21-1-01,"Transporte por navegação interior de carga, municipal, exceto travessia",Não,Autorização da ANTAC.
50.21-1-02,"Transporte por navegação interior de carga, intermunicipal, interestadual e internacional, exceto travessia",Não,Autorização da ANTAC.
50.22-0-01,"Transporte por navegação interior de passageiros em linhas regulares, municipal, exceto travessia",Não,Autorização da ANTAC.
50.22-0-02,"Transporte por navegação interior de passageiros em linhas regulares, intermunicipal, interestadual e internacional, exceto travessia",Não,Autorização da ANTAC.
50.91-2-01,"Transporte por navegação de travessia, municipal",Não,Autorização da ANTAC.
50.91-2-02,"Transporte por navegação de travessia, intermunicipal, interestadual e internacional",Não,Autorização da ANTAC.
50.99-8-01,Transporte aquaviário para passeios turísticos,Não,Autorização da ANTAC.
50.99-8-99,Outros transportes aquaviários não especificados anteriormente,Não,Autorização da ANTAC.
50.30-1-01,Navegação de apoio marítimo,Não,-
50.30-1-02,Navegação de apoio portuário,Não,-
50.30-1-03,Serviço de rebocadores e empurradores,Não,-
51.11-1-00,Transporte aéreo de passageiros regular,Não,-
51.12-9-01,Serviço de táxi aéreo e locação de aeronaves com tripulação,Não,-
51.12-9-99,Outros serviços de transporte aéreo de passageiros não regular,Não,-
51.20-0-00,Transporte aéreo de carga,Não,Autorização da ANAC ou termo de alvará provisório
51.30-7-00,Transporte espacial,Não,-
52.11-7-01,Armazéns gerais - emissão de warrant,Sim***,Ocupação bombeiros para depósito
52.11-7-02,Guarda-móveis,Não,-
52.11-7-99,"Depósitos de mercadorias para terceiros, exceto armazéns gerais e guarda-móveis",Não,Ocupação bombeiros para depósito
52.21-4-00,"Concessionárias de rodovias, pontes, túneis e serviços relacionados",Não,-
52.22-2-00,Terminais rodoviários e ferroviários,Sim,-
52.23-1-00,Estacionamento de veículos,Não,-
52.31-1-01,Administração da infraestrutura portuária,Não,-
52.31-1-02,Atividades do Operador Portuário,Não,-
52.31-1-03,Gestão de terminais aquaviários,Não,-
52.40-1-01,Operação dos aeroportos e campos de aterrissagem,Não,-
52.50-8-01,Comissaria de despachos,Não,-
52.12-5-00,Carga e descarga,Não,-
52.29-0-01,"Serviços de apoio ao transporte por táxi, inclusive centrais de chamada",Não,-
52.29-0-02,Serviços de reboque de veículos,Não,-
52.29-0-99,Outras atividades auxiliares dos transportes terrestres não especificadas anteriormente,Não,-
52.32-0-00,Atividades de agenciamento marítimo,Não,-
52.39-7-01,Serviços de praticagem,Não,-
52.39-7-99,Atividades auxiliares dos transportes aquaviários não especificadas anteriormente,Não,-
52.40-1-99,"Atividades auxiliares dos transportes aéreos, exceto operação dos aeroportos e campos de aterrissagem",Não,-
52.50-8-02,Atividades de despachantes aduaneiros,Não,-
52.50-8-03,"Agenciamento de cargas, exceto para o transporte marítimo",Não,-
52.50-8-04,Organização logística do transporte de carga,Não,-
52.50-8-05,Operador de transporte multimodal - OTM,Não,-
53.10-5-01,Atividades do Correio Nacional,Não,-
53.10-5-02,Atividades de franqueadas e permissionárias do Correio Nacional,Não,-
53.20-2-01,Serviços de malote não realizados pelo Correio Nacional,Não,-
53.20-2-02,Serviços de entrega rápida,Não,-
55.10-8-01,Hotéis,Sim***,Atestado de vistoria do CBMSC com ocupação de Serviço de Hospedagem.
55.10-8-02,Apart-hotéis,Sim***,Atestado de vistoria do CBMSC com ocupação de Serviço de Hospedagem.
55.10-8-03,Motéis,Não,Atestado de vistoria do CBMSC com ocupação de Serviço de Hospedagem.
55.90-6-01,"Albergues, exceto assistenciais",Não,Atestado de vistoria do CBMSC com ocupação de Serviço de Hospedagem.
55.90-6-02,Campings,Não,-
55.90-6-03,Pensões (alojamento),Não,Atestado de vistoria do CBMSC com ocupação de Serviço de Hospedagem.
55.90-6-99,Outros alojamentos não especificados anteriormente,Não,Atestado de vistoria do CBMSC com ocupação de Serviço de Hospedagem.
56.11-2-01,Restaurantes e similares,Sim***,-
56.11-2-05,"Bares e outros estabelecimentos especializados em servir bebidas, com entretenimento",Sim***,Laudo acústico + ART. Atestado dos bombeiros com ocupação de reunião de público
56.11-2-03,"Lanchonetes, casas de chá, de sucos e similares",Não,-
56.11-2-04,"Bares e outros estabelecimentos especializados em servir bebidas, sem entretenimento",Sim***,Laudo acústico + ART. Atestado dos bombeiros com ocupação de reunião de público
56.20-1-03,Cantinas - serviços de alimentação privativos,Não,-
56.12-1-00,Serviços ambulantes de alimentação,Não,-
56.20-1-01,Fornecimento de alimentos preparados preponderantemente para empresas,Não,-
56.20-1-02,Serviços de alimentação para eventos e recepções - bufê,Não,-
56.20-1-04,Fornecimento de alimentos preparados preponderantemente para consumo domiciliar,Não,-
58.11-5-00,Edição de livros,Não,-
58.12-3-01,Edição de jornais diários,Não,-
58.12-3-02,Edição de jornais não diários,Não,-
58.13-1-00,Edição de revistas,Não,-
58.19-1-00,"Edição de cadastros, listas e outros produtos gráficos",Não,-
58.21-2-00,Edição integrada à impressão de livros,Não,-
58.22-1-01,Edição integrada à impressão de jornais diários,Não,-
58.22-1-02,Edição integrada à impressão de jornais não diários,Não,-
58.23-9-00,Edição integrada à impressão de revistas,Não,-
58.29-8-00,"Edição integrada à impressão de cadastros, listas e outros produtos gráficos",Não,-
59.11-1-01,Estúdios cinematográficos,Não,-
59.11-1-02,Produção de filmes para publicidade,Não,-
59.11-1-99,"Atividades de produção cinematográfica, de vídeos e de programas de televisão não especificadas anteriormente",Não,-
59.12-0-01,Serviços de dublagem,Não,-
59.12-0-02,Serviços de mixagem sonora em produção audiovisual,Não,-
59.12-0-99,"Atividades de pós-produção cinematográfica, de vídeos e de programas de televisão não especificadas anteriormente",Não,-
59.13-8-00,"Distribuição cinematográfica, de vídeo e de programas de televisão",Não,-
59.14-6-00,Atividades de exibição cinematográfica,Não,-
59.20-1-00,Atividades de gravação de som e de edição de música,Não,-
60.10-1-00,Atividades de rádio,Não,Autorização da ANATEL; CMGDT
60.21-7-00,Atividades de televisão aberta,Não,-
60.22-5-01,Programadoras,Não,-
60.22-5-02,"Atividades relacionadas à televisão por assinatura, exceto programadoras",Não,-
61.10-8-01,Serviços de telefonia fixa comutada - STFC,Não,-
61.10-8-02,Serviços de redes de transporte de telecomunicações - SRTT,Não,-
61.10-8-03,Serviços de comunicação multimídia - SCM,Não,-
61.10-8-99,Serviços de telecomunicações por fio não especificados anteriormente,Não,-
61.20-5-01,Telefonia móvel celular,Não,-
61.20-5-02,Serviço móvel especializado - SME,Não,-
61.20-5-99,Serviços de telecomunicações sem fio não especificados anteriormente,Não,-
61.30-2-00,Telecomunicações por satélite,Não,-
61.41-8-00,Operadoras de televisão por assinatura por cabo,Não,-
61.42-6-00,Operadoras de televisão por assinatura por micro-ondas,Não,-
61.43-4-00,Operadoras de televisão por assinatura por satélite,Não,-
61.90-6-01,Provedores de acesso às redes de comunicações,Não,-
61.90-6-02,Provedores de voz sobre protocolo Internet - VOIP,Não,-
61.90-6-99,Outras atividades de telecomunicações não especificadas anteriormente,Não,-
62.01-5-01,Desenvolvimento de programas de computador sob encomenda,Não,-
62.01-5-02,Web desing,Não,-
62.02-3-00,Desenvolvimento e licenciamento de programas de computador customizáveis,Não,-
62.03-1-00,Desenvolvimento e licenciamento de programas de computador não customizáveis,Não,-
62.04-0-00,Consultoria em tecnologia da informação,Não,-
62.09-1-00,"Suporte técnico, manutenção e outros serviços em tecnologia da informação",Não,-
63.11-9-00,"Tratamento de dados, provedores de serviços de aplicação e serviços de hospedagem na Internet",Não,-
63.19-4-00,"Portais, provedores de conteúdo e outros serviços de informação na Internet",Não,-
63.91-7-00,Agências de notícias,Não,-
63.99-2-00,Outras atividades de prestação de serviços de informação não especificadas anteriormente,Não,-
64.10-7-00,Banco Central,Não,-
64.21-2-00,Bancos comerciais,Não,-
64.22-1-00,"Bancos múltiplos, com carteira comercial",Não,-
64.23-9-00,Caixas econômicas,Não,-
64.24-7-01,Bancos cooperativos,Não,-
64.24-7-02,Cooperativas centrais de crédito,Não,-
64.24-7-03,Cooperativas de crédito mútuo,Não,-
64.24-7-04,Cooperativas de crédito rural,Não,-
64.31-0-00,"Bancos múltiplos, sem carteira comercial",Não,-
64.32-8-00,Bancos de investimento,Não,-
64.33-6-00,Bancos de desenvolvimento,Não,-
64.38-7-01,Bancos de câmbio,Não,-
64.38-7-99,Outras instituições de intermediação não monetária não especificadas anteriormente,Não,-
64.34-4-00,Agências de fomento,Não,-
64.35-2-01,Sociedades de crédito imobiliário,Não,-
64.35-2-02,Associações de poupança e empréstimo,Não,-
64.35-2-03,Companhias hipotecárias,Não,-
64.36-1-00,"Sociedades de crédito, financiamento e investimento - financeiras",Não,-
64.37-9-00,Sociedades de crédito ao microempreendedor,Não,-
64.40-9-00,Arrendamento mercantil,Não,-
64.50-6-00,Sociedades de capitalização,Não,-
64.61-1-00,Holdings de instituições financeiras,Não,-
64.62-0-00,Holdings de instituições não financeiras,Não,-
64.63-8-00,"Outras sociedades de participação, exceto holdings",Não,-
64.70-1-01,"Fundos de investimento, exceto previdenciários e imobiliários",Não,-
64.70-1-02,Fundos de investimento previdenciários,Não,-
64.70-1-03,Fundos de investimento imobiliários,Não,-
64.91-3-00,Sociedades de fomento mercantil - factoring,Não,-
64.92-1-00,Securitização de créditos,Não,-
64.93-0-00,Administração de consórcios para aquisição de bens e direitos,Não,-
64.99-9-01,Clubes de investimento,Não,-
64.99-9-02,Sociedades de investimento,Não,-
64.99-9-03,Fundo garantidor de crédito,Não,-
64.99-9-04,Caixas de financiamento de corporações,Não,-
64.99-9-05,Concessão de crédito pelas OSCIP,Não,-
64.99-9-99,Outras atividades de serviços financeiros não especificadas anteriormente,Não,-
65.11-1-01,Sociedade seguradora de seguros vida,Não,-
65.11-1-02,Planos de auxílio-funeral,Não,-
65.12-0-00,Sociedade seguradora de seguros não vida,Não,-
65.20-1-00,Sociedade seguradora de seguros-saúde,Não,-
65.30-8-00,Resseguros,Não,-
65.41-3-00,Previdência complementar fechada,Não,-
65.42-1-00,Previdência complementar aberta,Não,-
65.50-2-00,Planos de saúde,Não,-
66.11-8-01,Bolsa de valores,Não,-
66.11-8-02,Bolsa de mercadorias,Não,-
66.11-8-03,Bolsa de mercadorias e futuros,Não,-
66.11-8-04,Administração de mercados de balcão organizados,Não,-
66.12-6-01,Corretoras de títulos e valores mobiliários,Não,-
66.12-6-02,Distribuidoras de títulos e valores mobiliários,Não,-
66.12-6-03,Corretoras de câmbio,Não,-
66.12-6-04,Corretoras de contratos de mercadorias,Não,-
66.12-6-05,Agentes de investimentos em aplicações financeiras,Não,-
66.13-4-00,Administração de cartões de crédito,Não,-
66.19-3-01,Serviços de liquidação e custódia,Não,-
66.19-3-02,Correspondentes de instituições financeiras,Não,-
66.19-3-03,Representações de bancos estrangeiros,Não,-
66.19-3-04,Caixas eletrônicos,Não,-
66.19-3-05,Operadoras de cartões de débito,Não,-
66.19-3-99,Outras atividades auxiliares dos serviços financeiros não especificadas anteriormente,Não,-
66.21-5-01,Peritos e avaliadores de seguros,Não,-
66.21-5-02,Auditoria e consultoria atuarial,Não,-
66.22-3-00,"Corretores e agentes de seguros, de planos de previdência complementar e de saúde",Não,-
66.29-1-00,"Atividades auxiliares dos seguros, da previdência complementar e dos planos de saúde não especificadas anteriormente",Não,-
66.30-4-00,Atividades de administração de fundos por contrato ou comissão,Não,-
68.10-2-01,Compra e venda de imóveis próprios,Não,-
68.10-2-02,Aluguel de imóveis próprios,Não,-
68.10-2-03,Loteamento de imóveis próprios,Sim,-
68.21-8-01,Corretagem na compra e venda e avaliação de imóveis,Não,-
68.21-8-02,Corretagem no aluguel de imóveis,Não,-
68.22-6-00,Gestão e administração da propriedade imobiliária,Não,-
69.11-7-01,Serviços advocatícios,Não,-
69.11-7-02,Atividades auxiliares da justiça,Não,-
69.11-7-03,Agente de propriedade industrial,Não,-
69.20-6-01,Atividades de contabilidade,Não,-
69.20-6-02,Atividades de consultoria e auditoria contábil e tributária,Não,-
69.12-5-00,Cartórios,Não,-
70.20-4-00,"Atividades de consultoria em gestão empresarial, exceto consultoria técnica específica",Não,-
71.11-1-00,Serviços de arquitetura,Não,-
71.12-0-00,Serviços de engenharia,Não,-
71.19-7-01,"Serviços de cartografia, topografia e geodésia",Não,-
71.19-7-02,Atividades de estudos geológicos,Não,-
71.19-7-03,Serviços de desenho técnico relacionados à arquitetura e engenharia,Não,-
71.19-7-04,Serviços de perícia técnica relacionados à segurança do trabalho,Não,-
71.19-7-99,Atividades técnicas relacionadas à engenharia e arquitetura não especificadas anteriormente,Não,-
71.20-1-00,Testes e análises técnicas,Não,"Caso seja uma empresa de vistoria veicular: Precisa de autorização do DETRAN. Documento obtido de forma posterior, precisa de alvará provisório"
72.10-0-00,Pesquisa e desenvolvimento experimental em ciências físicas e naturais,Não,-
72.20-7-00,Pesquisa e desenvolvimento experimental em ciências sociais e humanas,Não,-
73.11-4-00,Agências de publicidade,Não,-
73.12-2-00,"Agenciamento de espaços para publicidade, exceto em veículos de comunicação",Não,-
73.19-0-01,Criação de estandes para feiras e exposições,Não,-
73.19-0-02,Promoção de vendas,Não,-
73.19-0-03,Marketing direto,Não,-
73.19-0-04,Consultoria em publicidade,Não,-
73.19-0-99,Outras atividades de publicidade não especificadas anteriormente,Não,-
73.20-3-00,Pesquisas de mercado e de opinião pública,Não,-
74.10-2-02,Design de interiores,Não,-
74.10-2-03,Desing de produto,Não,-
74.10-2-99,Atividades de desing não especificadas anteriormente,Não,-
74.20-0-01,"Atividades de produção de fotografias, exceto aérea e submarina",Não,-
74.20-0-02,Atividades de produção de fotografias aéreas e submarinas,Não,-
74.20-0-03,Laboratórios fotográficos,Não,-
74.20-0-04,Filmagem de festas e eventos,Não,-
74.20-0-05,Serviços de microfilmagem,Não,-
74.90-1-01,"Serviços de tradução, interpretação e similares",Não,-
74.90-1-02,Escafandria e mergulho,Não,-
74.90-1-03,Serviços de agronomia e de consultoria às atividades agrícolas e pecuárias,Não,-
74.90-1-04,"Atividades de intermediação e agenciamento de serviços e negócios em geral, exceto imobiliários",Não,-
74.90-1-05,"Agenciamento de profissionais para atividades esportivas, culturais e artísticas",Não,-
74.90-1-99,"Outras atividades profissionais, científicas e técnicas não especificadas anteriormente",Não,-
75.00-1-00,Atividades veterinárias,Sim,-
77.11-0-00,Locação de automóveis sem condutor,Não,-
77.19-5-01,"Locação de embarcações sem tripulação, exceto para fins recreativos",Não,-
77.19-5-02,Locação de aeronaves sem tripulação,Não,-
77.19-5-99,"Locação de outros meios de transporte não especificados anteriormente, sem condutor",Não,-
77.21-7-00,Aluguel de equipamentos recreativos e esportivos,Não,-
77.22-5-00,"Aluguel de fitas de vídeo, DVDs e similares",Não,-
77.23-3-00,"Aluguel de objetos do vestuário, jóias e acessórios",Não,-
77.29-2-01,Aluguel de aparelhos de jogos eletrônicos,Não,-
77.29-2-02,"Aluguel de móveis, utensílios e aparelhos de uso doméstico e pessoal; instrumentos musicais",Não,-
77.29-2-03,Aluguel de material médico,Não,-
77.29-2-99,Aluguel de outros objetos pessoais e domésticos não especificados anteriormente,Não,-
77.31-4-00,Aluguel de máquinas e equipamentos agrícolas sem operador,Não,-
77.32-2-01,"Aluguel de máquinas e equipamentos para construção sem operador, exceto andaimes",Não,-
77.32-2-02,Aluguel de andaimes,Não,-
77.33-1-00,Aluguel de máquinas e equipamentos para escritório,Não,-
77.39-0-01,"Aluguel de máquinas e equipamentos para extração de minérios e petróleo, sem operador",Não,-
77.39-0-02,"Aluguel de equipamentos científicos, médicos e hospitalares, sem operador",Não,-
77.39-0-03,"Aluguel de palcos, coberturas e outras estruturas de uso temporário, exceto andaimes",Não,-
77.39-0-99,"Aluguel de outras máquinas e equipamentos comerciais e industriais não especificados anteriormente, sem operador",Não,-
77.40-3-00,Gestão de ativos intangíveis não financeiros,Não,-
78.10-8-00,Seleção e agenciamento de mão de obra,Não,-
78.20-5-00,Locação de mão de obra temporária,Não,-
78.30-2-00,Fornecimento e gestão de recursos humanos para terceiros,Não,-
79.11-2-00,Agências de viagens,Não,-
79.12-1-00,Operadores turísticos,Não,-
79.90-2-00,Serviços de reservas e outros serviços de turismo não especificados anteriormente,Não,-
80.11-1-01,Atividades de vigilância e segurança privada,Não,-
80.11-1-02,Serviços de adestramento de cães de guarda,Não,-
80.12-9-00,Atividades de transporte de valores,Não,-
80.20-0-01,Atividades de monitoramento de sistemas de segurança eletrônico,Não,-
80.20-0-02,Outras atividades de serviços de segurança,Não,-
80.30-7-00,Atividades de investigação particular,Não,-
81.11-7-00,"Serviços combinados para apoio a edifícios, exceto condomínios prediais",Não,-
81.21-4-00,Limpeza em prédios e em domicílios,Não,-
81.29-0-00,Atividades de limpeza não especificadas anteriormente,Não,-
81.30-3-00,Atividades paisagísticas,Não,-
81.12-5-00,Condomínios prediais,Não,-
81.22-2-00,Imunização e controle de pragas urbanas,Sim,-
82.11-3-00,Serviços combinados de escritório e apoio administrativo,Não,-
82.19-9-01,Fotocópias,Não,-
82.19-9-99,Preparação de documentos e serviços especializados de apoio administrativo não especificados anteriormente,Não,-
82.20-2-00,Atividades de teleatendimento,Não,-
82.30-0-01,"Serviços de organização de feiras, congressos, exposições e festas",Não,-
82.91-1-00,Atividades de cobrança e informações cadastrais,Não,-
82.99-7-01,"Medição de consumo de energia elétrica, gás e água",Não,-
82.99-7-02,"Emissão de vales-alimentação, vales-transporte e similares",Não,-
82.99-7-03,"Serviços de gravação de carimbos, exceto confecção",Não,-
82.99-7-04,Leiloeiros independentes,Não,-
82.99-7-05,Serviços de levantamento de fundos sob contrato,Não,-
82.99-7-99,Outras atividades de serviços prestados principalmente às empresas não especificadas anteriormente,Não,"Caso seja uma empresa de vistoria veicular: Precisa de autorização do DETRAN. Documento obtido de forma posterior, precisa de alvará provisório"
82.30-0-02,Casas de festas e eventos,Não,Laudo acustico + ART. Bombeiros para reunião de público. CMGDT
82.99-7-06,Casas lotéricas,Não,Autorização da CAIXA ECONÕMICA FEDERAL
82.92-0-00,Envasamento e empacotamento sob contrato,Não,-
82.99-7-07,Salas de acesso à Internet,Não,-
84.11-6-00,Administração pública em geral,Não,-
84.12-4-00,"Regulação das atividades de saúde, educação, serviços culturais e outros serviços sociais",Não,-
84.13-2-00,Regulação das atividades econômicas,Não,-
84.21-3-00,Relações exteriores,Não,-
84.22-1-00,Defesa,Não,-
84.23-0-00,Justiça,Não,-
84.24-8-00,Segurança e ordem pública,Não,-
84.25-6-00,Defesa Civil,Não,-
84.30-2-00,Seguridade social obrigatória,Não,-
85.11-2-00,Educação infantil - creche,Não,Certificado do Conselho Municipal de Educação (COMED) - Alvará Provisório - CMGDT acima de 300m2
85.12-1-00,Educação infantil - pré-escola,Não,Certificado do Conselho Municipal de Educação (COMED) - Alvará Provisório - CMGDT acima de 300m2
85.13-9-00,Ensino fundamental,Não,Ocupação escolar bombeiros
85.20-1-00,Ensino médio,Não,Ocupação escolar bombeiros
85.31-7-00,Educação superior - graduação,Não,-
85.32-5-00,Educação superior - graduação e pós-graduação,Não,-
85.33-3-00,Educação superior - pós-graduação e extensão,Não,-
85.41-4-00,Educação profissional de nível técnico,Não,-
85.42-2-00,Educação profissional de nível tecnológico,Não,-
85.50-3-01,Administração de caixas escolares,Não,-
85.50-3-02,"Atividades de apoio à educação, exceto caixas escolares",Não,-
85.91-1-00,Ensino de esportes,Não,Ocupação escolar bombeiros
85.92-9-01,Ensino de dança,Não,Ocupação escolar bombeiros
85.92-9-02,"Ensino de artes cênicas, exceto dança",Não,Ocupação escolar bombeiros
85.92-9-03,Ensino de música,Não,Ocupação escolar bombeiros
85.92-9-99,Ensino de arte e cultura não especificado anteriormente,Não,Ocupação escolar bombeiros
