codigo,descricao,la,outros_documentos
20.92-4-01,"Fabricação de pólvoras, explosivos e detonantes",Sim,Atestado CBSM ocupação industrial
20.92-4-02,Fabricação de artigos pirotécnicos,Sim,Atestado CBSM ocupação industrial
20.92-4-03,Fabricação de fósforos de segurança,Sim,Atestado CBSM ocupação industrial
20.93-2-00,Fabricação de aditivos de uso industrial,Sim,Atestado CBSM ocupação industrial
20.94-1-00,Fabricação de catalisadores,Sim,Atestado CBSM ocupação industrial
20.99-1-01,"Fabricação de chapas, filmes, papéis e outros materiais e produtos químicos para fotografia",Sim,Atestado CBSM ocupação industrial
20.99-1-99,Fabricação de outros produtos químicos não especificados anteriormente,Sim,Atestado CBSM ocupação industrial
21.10-6-00,Fabricação de produtos farmoquímicos,Sim,Atestado CBSM ocupação industrial
21.21-1-01,Fabricação de medicamentos alopáticos para uso humano,Sim,Atestado CBSM ocupação industrial
21.21-1-02,Fabricação de medicamentos homeopáticos para uso humano,Sim,Atestado CBSM ocupação industrial
21.21-1-03,Fabricação de medicamentos fitoterápicos para uso humano,Sim,Atestado CBSM ocupação industrial
21.22-0-00,Fabricação de medicamentos para uso veterinário,Sim,Atestado CBSM ocupação industrial
21.23-8-00,Fabricação de preparações farmacêuticas,Sim,Atestado CBSM ocupação industrial
22.11-1-00,Fabricação de pneumáticos e de câmaras-de-ar,Sim,Atestado CBSM ocupação industrial
22.19-6-00,Fabricação de artefatos de borracha não especificados  anteriormente,Sim,Atestado CBSM ocupação industrial
22.21-8-00,Fabricação de laminados planos e tubulares de material plástico,Sim,Atestado CBSM ocupação industrial
22.22-6-00,Fabricação de embalagens de material plástico,Sim,Atestado CBSM ocupação industrial
22.23-4-00,Fabricação de tubos e acessórios de material plástico para uso na construção,Sim,Atestado CBSM ocupação industrial
22.29-3-01,Fabricação de artefatos de material plástico para uso pessoal e doméstico,Sim,Atestado CBSM ocupação industrial
22.29-3-02,Fabricação de artefatos de material plástico para usos industriais,Sim,Atestado CBSM ocupação industrial
22.29-3-03,"Fabricação de artefatos de material plástico para uso na construção, exceto tubos e acessórios",Sim,Atestado CBSM ocupação industrial
22.29-3-99,Fabricação de artefatos de material plástico para outros usos não especificados anteriormente,Sim,Atestado CBSM ocupação industrial
22.12-9-00,Reforma de pneumáticos usados,Sim,-
23.11-7-00,Fabricação de vidro plano e de segurança,Sim,Atestado CBSM ocupação industrial
23.12-5-00,Fabricação de embalagens de vidro,Sim,Atestado CBSM ocupação industrial
23.19-2-00,Fabricação de artigos de vidro,Sim,Atestado CBSM ocupação industrial
23.30-3-01,"Fabricação de estruturas pré-moldadas de concreto armado, em série e sob encomenda",Sim,Atestado CBSM ocupação industrial
23.30-3-02,Fabricação de artefatos de cimento para uso na construção,Sim,Atestado CBSM ocupação industrial
23.30-3-03,Fabricação de artefatos de fibrocimento para uso na construção,Sim,Atestado CBSM ocupação industrial
23.30-3-04,Fabricação de casas pré-moldadas de concreto,Não,Atestado CBSM ocupação industrial
23.30-3-05,Preparação de massa de concreto e argamassa para construção,Sim,-
23.30-3-99,"Fabricação de outros artefatos e produtos de concreto, cimento, fibrocimento, gesso e materiais semelhantes",Não,Atestado CBSM ocupação industrial
23.41-9-00,Fabricação de produtos cerâmicos refratários,Não,Atestado CBSM ocupação industrial
23.42-7-01,Fabricação de azulejos e pisos,Sim,Atestado CBSM ocupação industrial
23.42-7-02,"Fabricação de artefatos de cerâmica e barro cozido para uso na construção, exceto azulejos e pisos",Sim,Atestado CBSM ocupação industrial
23.49-4-01,Fabricação de material sanitário de cerâmica,Sim,Atestado CBSM ocupação industrial
23.49-4-99,Fabricação de produtos cerâmicos não refratários não especificados anteriormente,Sim,Atestado CBSM ocupação industrial
23.20-6-00,Fabricação de cimento,Sim,Atestado CBSM ocupação industrial
23.91-5-01,"Britamento de pedras, exceto associado à extração",Sim,-
23.91-5-02,"Aparelhamento de pedras para construção, exceto associado à extração",Sim,-
23.91-5-03,"Aparelhamento de placas e execução de trabalhos em mármore, granito, ardósia e outras pedras",Sim,-
23.92-3-00,Fabricação de cal e gesso,Sim,Atestado CBSM ocupação industrial
23.99-1-02,Fabricação de abrasivos,Sim,Atestado CBSM ocupação industrial
23.99-1-99,Fabricação de outros produtos de minerais não metálicos não especificados anteriormente,Sim,Atestado CBSM ocupação industrial
23.99-1-01,"Decoração, lapidação, gravação, vitrificação e outros trabalhos em cerâmica, louça, vidro e cristal",Sim,-
24.11-3-00,Produção de ferro-gusa,Sim,-
24.12-1-00,Produção de ferroligas,Sim,-
24.21-1-00,Produção de semiacabados de aço,Sim,-
24.22-9-01,"Produção de laminados planos de aço ao carbono, revestidos ou não",Sim,-
24.22-9-02,Produção de laminados planos de aços especiais,Sim,-
24.23-7-01,Produção de tubos de aço sem costura,Sim,-
24.23-7-02,"Produção de laminados longos de aço, exceto tubos",Sim,-
24.24-5-01,Produção de arames de aço,Sim,-
24.24-5-02,"Produção de relaminados, trefilados e perfilados de aço, exceto arames",Sim,-
24.31-8-00,Produção de tubos de aço com costura,Sim,-
24.39-3-00,Produção de outros tubos de ferro e aço,Sim,-
24.41-5-01,Produção de alumínio e suas ligas em formas primárias,Sim,-
24.41-5-02,Produção de laminados de alumínio,Sim,-
24.42-3-00,Metalurgia dos metais preciosos,Sim,-
24.43-1-00,Metalurgia do cobre,Sim,-
24.49-1-01,Produção de zinco em formas primárias,Sim,-
24.49-1-02,Produção de laminados de zinco,Sim,-
24.49-1-03,Fabricação de ânodos para galvanoplastia,Sim,Atestado CBSM ocupação industrial
24.49-1-99,Metalurgia de outros metais não ferrosos e suas ligas não especificados anteriormente,Sim,-
24.51-2-00,Fundição de ferro e aço,Sim,-
24.52-1-00,Fundição de metais não ferrosos e suas ligas,Sim,-
25.11-0-00,Fabricação de estruturas metálicas,Não,Atestado CBSM ocupação industrial
25.12-8-00,Fabricação de esquadrias de metal,Sim,Atestado CBSM ocupação industrial
25.13-6-00,Fabricação de obras de caldeiraria pesada,Não,Atestado CBSM ocupação industrial
25.21-7-00,"Fabricação de tanques, reservatórios metálicos e caldeiras para aquecimento central",Sim,Atestado CBSM ocupação industrial
25.22-5-00,"Fabricação de caldeiras geradoras de vapor, exceto para aquecimento central e para veículos",Sim,Atestado CBSM ocupação industrial
25.31-4-01,Produção de forjados de aço,Sim,-
25.31-4-02,Produção de forjados de metais não ferrosos e suas ligas,Sim,-
25.32-2-01,Produção de artefatos estampados de metal,Sim,-
25.32-2-02,Metalurgia do pó,Sim,-
25.41-1-00,Fabricação de artigos de cutelaria,Sim,Atestado CBSM ocupação industrial
25.42-0-00,"Fabricação de artigos de serralheria, exceto esquadrias",Sim,Atestado CBSM ocupação industrial
25.43-8-00,Fabricação de ferramentas,Sim,Atestado CBSM ocupação industrial
25.91-8-00,Fabricação de embalagens metálicas,Sim,Atestado CBSM ocupação industrial
25.92-6-01,Fabricação de produtos de trefilados de metal padronizados,Sim,Atestado CBSM ocupação industrial
25.92-6-02,"Fabricação de produtos de trefilados de metal, exceto padronizados",Sim,Atestado CBSM ocupação industrial
25.93-4-00,Fabricação de artigos de metal para uso doméstico e pessoal,Sim,Atestado CBSM ocupação industrial
25.99-3-99,Fabricação de outros produtos de metal não especificados anteriormente,Sim,Atestado CBSM ocupação industrial
25.39-0-01,"Serviços de usinagem, torneiria e solda",Sim,-
25.99-3-01,Serviços de confecção de armações metálicas para a construção,Não,-
25.99-3-02,Serviço de corte e dobra de metais,Não,-
25.39-0-02,Serviços de tratamento e revestimento em metais,Sim,-
25.50-1-01,"Fabricação de equipamento bélico pesado, exceto veículos militares de combate",Sim,Atestado CBSM ocupação industrial
25.50-1-02,"Fabricação de armas de fogo, outras armas e munições",Sim,Atestado CBSM ocupação industrial
26.10-8-00,Fabricação de componentes eletrônicos,Sim,Atestado CBSM ocupação industrial
26.21-3-00,Fabricação de equipamentos de informática,Sim,Atestado CBSM ocupação industrial
26.22-1-00,Fabricação de periféricos para equipamentos de informática,Sim,Atestado CBSM ocupação industrial
26.31-1-00,"Fabricação de equipamentos transmissores de comunicação, peças e acessórios",Sim,Atestado CBSM ocupação industrial
26.32-9-00,"Fabricação de aparelhos telefônicos e de outros equipamentos de comunicação, peças e acessórios",Sim,Atestado CBSM ocupação industrial
26.40-0-00,"Fabricação de aparelhos de recepção, reprodução, gravação e amplificação de áudio e vídeo",Sim,Atestado CBSM ocupação industrial
26.51-5-00,"Fabricação de aparelhos e equipamentos de medida, teste e controle",Sim,Atestado CBSM ocupação industrial
26.52-3-00,Fabricação de cronômetros e relógios,Sim,Atestado CBSM ocupação industrial
26.70-1-01,"Fabricação de equipamentos e instrumentos ópticos, peças e acessórios",Sim,Atestado CBSM ocupação industrial
26.70-1-02,"Fabricação de aparelhos fotográficos e cinematográficos, peças e acessórios",Sim,Atestado CBSM ocupação industrial
26.80-9-00,"Fabricação de mídias virgens, magnéticas e ópticas",Sim,Atestado CBSM ocupação industrial
26.60-4-00,Fabricação de aparelhos eletromédicos e eletroterapêuticos e equipamentos de irradiação,Sim,Atestado CBSM ocupação industrial
27.10-4-01,"Fabricação de geradores de corrente contínua e alternada, peças e acessórios",Sim,Atestado CBSM ocupação industrial
27.10-4-02,"Fabricação de transformadores, indutores, conversores, sincronizadores e semelhantes, peças e acessórios",Sim,Atestado CBSM ocupação industrial
27.10-4-03,"Fabricação de motores elétricos, peças e acessórios",Sim,Atestado CBSM ocupação industrial
27.31-7-00,Fabricação de aparelhos e equipamentos para distribuição e controle de energia elétrica,Sim,Atestado CBSM ocupação industrial
27.32-5-00,Fabricação de material elétrico para instalações em circuito de consumo,Sim,Atestado CBSM ocupação industrial
27.33-3-00,"Fabricação de fios, cabos e condutores elétricos isolados",Sim,Atestado CBSM ocupação industrial
27.40-6-01,Fabricação de lâmpadas,Sim,Atestado CBSM ocupação industrial
27.40-6-02,Fabricação de luminárias e outros equipamentos de iluminação,Sim,Atestado CBSM ocupação industrial
27.51-1-00,"Fabricação de fogões, refrigeradores e máquinas de lavar e secar para uso doméstico, peças e acessórios",Sim,Atestado CBSM ocupação industrial
27.59-7-01,"Fabricação de aparelhos elétricos de uso pessoal, peças e acessórios",Sim,Atestado CBSM ocupação industrial
27.59-7-99,"Fabricação de outros aparelhos eletrodomésticos não especificados anteriormente, peças e acessórios",Sim,Atestado CBSM ocupação industrial
27.90-2-01,"Fabricação de eletrodos, contatos e outros artigos de carvão e grafita para uso elétrico, eletroímãs e isoladores",Sim,Atestado CBSM ocupação industrial
27.90-2-02,Fabricação de equipamentos para sinalização e alarme,Sim,Atestado CBSM ocupação industrial
27.90-2-99,Fabricação de outros equipamentos e aparelhos elétricos não especificados anteriormente,Sim,Atestado CBSM ocupação industrial
27.21-0-00,"Fabricação de pilhas, baterias e acumuladores elétricos, exceto para veículos automotores",Sim,Atestado CBSM ocupação industrial
27.22-8-01,Fabricação de baterias e acumuladores para veículos automotores,Sim,Atestado CBSM ocupação industrial
27.22-8-02,Recondicionamento de baterias e acumuladores para veículos automotores,Sim,-
28.11-9-00,"Fabricação de motores e turbinas, peças e acessórios, exceto para aviões e veículos rodoviários",Sim,Atestado CBSM ocupação industrial
28.12-7-00,"Fabricação de equipamentos hidráulicos e pneumáticos, peças e acessórios, exceto válvulas",Sim,Atestado CBSM ocupação industrial
28.13-5-00,"Fabricação de válvulas, registros e dispositivos semelhantes, peças e acessórios",Sim,Atestado CBSM ocupação industrial
28.14-3-01,"Fabricação de compressores para uso industrial, peças e acessórios",Sim,Atestado CBSM ocupação industrial
28.14-3-02,"Fabricação de compressores para uso não industrial, peças e acessórios",Sim,Atestado CBSM ocupação industrial
28.15-1-01,Fabricação de rolamentos para fins industriais,Sim,Atestado CBSM ocupação industrial
28.15-1-02,"Fabricação de equipamentos de transmissão para fins industriais, exceto rolamentos",Sim,Atestado CBSM ocupação industrial
28.21-6-01,"Fabricação de fornos industriais, aparelhos e equipamentos não elétricos para instalações térmicas, peças e acessórios",Sim,Atestado CBSM ocupação industrial
28.21-6-02,"Fabricação de estufas e fornos elétricos para fins industriais, peças e acessórios",Sim,Atestado CBSM ocupação industrial
28.22-4-01,"Fabricação de máquinas, equipamentos e aparelhos para transporte e elevação de pessoas, peças e acessórios",Sim,Atestado CBSM ocupação industrial
28.22-4-02,"Fabricação de máquinas, equipamentos e aparelhos para transporte e elevação de cargas, peças e acessórios",Sim,Atestado CBSM ocupação industrial
28.23-2-00,"Fabricação de máquinas e aparelhos de refrigeração e ventilação para uso industrial e comercial, peças e acessórios",Sim,Atestado CBSM ocupação industrial
28.24-1-01,Fabricação de aparelhos e equipamentos de ar condicionado para uso industrial,Sim,Atestado CBSM ocupação industrial
28.24-1-02,Fabricação de aparelhos e equipamentos de ar condicionado para uso não industrial,Sim,Atestado CBSM ocupação industrial
28.25-9-00,"Fabricação de máquinas e equipamentos para saneamento básico e ambiental, peças e acessórios",Sim,Atestado CBSM ocupação industrial
28.29-1-01,"Fabricação de máquinas de escrever, calcular e outros equipamentos não eletrônicos para escritório, peças e acessórios",Sim,Atestado CBSM ocupação industrial
28.29-1-99,"Fabricação de outras máquinas e equipamentos de uso geral não especificados anteriormente, peças e acessórios",Sim,Atestado CBSM ocupação industrial
28.31-3-00,"Fabricação de tratores agrícolas, peças e acessórios",Sim,Atestado CBSM ocupação industrial
28.32-1-00,"Fabricação de equipamentos para irrigação agrícola, peças e acessórios",Sim,Atestado CBSM ocupação industrial
28.33-0-00,"Fabricação de máquinas e equipamentos para a agricultura e pecuária, peças e acessórios, exceto para irrigação",Sim,Atestado CBSM ocupação industrial
28.40-2-00,"Fabricação de máquinas-ferramenta, peças e acessórios",Sim,Atestado CBSM ocupação industrial
28.51-8-00,"Fabricação de máquinas e equipamentos para a prospecção e extração de petróleo, peças e acessórios",Sim,Atestado CBSM ocupação industrial
28.52-6-00,"Fabricação de outras máquinas e equipamentos para uso na extração mineral, peças e acessórios, exceto na extração de petróleo",Sim,Atestado CBSM ocupação industrial
28.53-4-00,"Fabricação de tratores, peças e acessórios, exceto agrícolas",Sim,Atestado CBSM ocupação industrial
28.54-2-00,"Fabricação de máquinas e equipamentos para terraplenagem, pavimentação e construção, peças e acessórios, exceto tratores",Sim,Atestado CBSM ocupação industrial
28.61-5-00,"Fabricação de máquinas para a indústria metalúrgica, peças e acessórios, exceto máquinas-ferramenta",Sim,Atestado CBSM ocupação industrial
28.62-3-00,"Fabricação de máquinas e equipamentos para as indústrias de alimentos, bebidas e fumo, peças e acessórios",Sim,Atestado CBSM ocupação industrial
28.63-1-00,"Fabricação de máquinas e equipamentos para a indústria têxtil, peças e acessórios",Sim,Atestado CBSM ocupação industrial
28.64-0-00,"Fabricação de máquinas e equipamentos para as indústrias do vestuário, do couro e de calçados, peças e acessórios",Sim,Atestado CBSM ocupação industrial
28.65-8-00,"Fabricação de máquinas e equipamentos para as indústrias de celulose, papel e papelão e artefatos, peças e acessórios",Sim,Atestado CBSM ocupação industrial
28.66-6-00,"Fabricação de máquinas e equipamentos para a indústria do plástico, peças e acessórios",Sim,Atestado CBSM ocupação industrial
28.69-1-00,"Fabricação de máquinas e equipamentos para uso industrial específico não especificados anteriormente, peças e acessórios",Sim,Atestado CBSM ocupação industrial
29.10-7-01,"Fabricação de automóveis, camionetas e utilitários",Sim,Atestado CBSM ocupação industrial
29.10-7-02,"Fabricação de chassis com motor para automóveis, camionetas e utilitários",Sim,Atestado CBSM ocupação industrial
29.10-7-03,"Fabricação de motores para automóveis, camionetas e utilitários",Sim,Atestado CBSM ocupação industrial
29.20-4-01,Fabricação de caminhões e ônibus,Sim,Atestado CBSM ocupação industrial
29.20-4-02,Fabricação de motores para caminhões e ônibus,Sim,Atestado CBSM ocupação industrial
29.30-1-01,"Fabricação de cabines, carrocerias e reboques para caminhões",Sim,Atestado CBSM ocupação industrial
29.30-1-02,Fabricação de carrocerias para ônibus,Sim,Atestado CBSM ocupação industrial
29.30-1-03,"Fabricação de cabines, carrocerias e reboques para outros veículos automotores, exceto caminhões e ônibus",Sim,Atestado CBSM ocupação industrial
29.41-7-00,Fabricação de peças e acessórios para o sistema motor de veículos automotores,Sim,Atestado CBSM ocupação industrial
29.42-5-00,Fabricação de peças e acessórios para os sistemas de marcha e transmissão de veículos automotores,Sim,Atestado CBSM ocupação industrial
29.43-3-00,Fabricação de peças e acessórios para o sistema de freios de veículos automotores,Sim,Atestado CBSM ocupação industrial
29.44-1-00,Fabricação de peças e acessórios para o sistema de direção e suspensão de veículos automotores,Sim,Atestado CBSM ocupação industrial
29.45-0-00,"Fabricação de material elétrico e eletrônico para veículos automotores, exceto baterias",Sim,Atestado CBSM ocupação industrial
29.49-2-01,Fabricação de bancos e estofados para veículos automotores,Sim,Atestado CBSM ocupação industrial
29.49-2-99,Fabricação de outras peças e acessórios para veículos automotores não especificadas anteriormente,Sim,Atestado CBSM ocupação industrial
29.50-6-00,Recondicionamento e recuperação de motores para veículos automotores,Sim,-
30.11-3-01,Construção de embarcações de grande porte,Sim,-
30.11-3-02,"Construção de embarcações para uso comercial e para usos especiais, exceto de grande porte",Sim,-
30.12-1-00,Construção de embarcações para esporte e lazer,Sim,-
30.31-8-00,"Fabricação de locomotivas, vagões e outros materiais rodantes",Sim,Atestado CBSM ocupação industrial
30.32-6-00,Fabricação de peças e acessórios para veículos ferroviários,Sim,Atestado CBSM ocupação industrial
30.41-5-00,Fabricação de aeronaves,Sim,Atestado CBSM ocupação industrial
30.42-3-00,"Fabricação de turbinas, motores e outros componentes e peças para aeronaves",Sim,Atestado CBSM ocupação industrial
30.50-4-00,Fabricação de veículos militares de combate,Sim,Atestado CBSM ocupação industrial
30.91-1-01,Fabricação de motocicletas,Sim,Atestado CBSM ocupação industrial
30.91-1-02,Fabricação de peças e acessórios para motocicletas,Sim,Atestado CBSM ocupação industrial
30.92-0-00,"Fabricação de bicicletas e triciclos não motorizados, peças e acessórios",Sim,Atestado CBSM ocupação industrial
30.99-7-00,Fabricação de equipamentos de transporte não especificados anteriormente,Sim,Atestado CBSM ocupação industrial
31.01-2-00,Fabricação de móveis com predominância de madeira,Sim,Atestado CBSM ocupação industrial
31.02-1-00,Fabricação de móveis com predominância de metal,Sim,Atestado CBSM ocupação industrial
31.03-9-00,"Fabricação de móveis de outros materiais, exceto madeira e metal",Sim,Atestado CBSM ocupação industrial
31.04-7-00,Fabricação de colchões,Sim,Atestado CBSM ocupação industrial
32.11-6-01,Lapidação de gemas,Sim,-
32.11-6-03,Cunhagem de moedas e medalhas,Sim,-
32.11-6-02,Fabricação de artefatos de joalheria e ourivesaria,Sim,Atestado CBSM ocupação industrial
32.12-4-00,Fabricação de bijuterias e artefatos semelhantes,Sim,Atestado CBSM ocupação industrial
32.40-0-01,Fabricação de jogos eletrônicos,Sim,Atestado CBSM ocupação industrial
32.20-5-00,"Fabricação de instrumentos musicais, peças e acessórios",Sim,Atestado CBSM ocupação industrial
32.30-2-00,Fabricação de artefatos para pesca e esporte,Sim,Atestado CBSM ocupação industrial
32.40-0-02,"Fabricação de mesas de bilhar, de sinuca e acessórios não associada à locação",Sim,Atestado CBSM ocupação industrial
32.40-0-03,"Fabricação de mesas de bilhar, de sinuca e acessórios associada à locação",Sim,Atestado CBSM ocupação industrial
32.40-0-99,Fabricação de outros brinquedos e jogos recreativos não especificados anteriormente,Sim,Atestado CBSM ocupação industrial
32.50-7-01,"Fabricação de instrumentos não eletrônicos e utensílios para uso médico, cirúrgico, odontológico e de laboratório",Sim,Atestado CBSM ocupação industrial
32.50-7-02,"Fabricação de mobiliário para uso médico, cirúrgico, odontológico e de laboratório",Sim,Atestado CBSM ocupação industrial
32.50-7-03,Fabricação de aparelhos e utensílios para correção de defeitos físicos e aparelhos ortopédicos em geral sob encomenda,Sim,Atestado CBSM ocupação industrial
32.50-7-04,"Fabricação de aparelhos e utensílios para correção de defeitos físicos e aparelhos ortopédicos em geral, exceto sob encomenda",Sim,Atestado CBSM ocupação industrial
32.50-7-05,Fabricação de materiais para medicina e odontologia,Sim,Atestado CBSM ocupação industrial
32.50-7-07,Fabricação de artigos ópticos,Sim,Atestado CBSM ocupação industrial
32.91-4-00,"Fabricação de escovas, pincéis e vassouras",Sim,Atestado CBSM ocupação industrial
32.92-2-01,Fabricação de roupas de proteção e segurança e resistentes a fogo,Sim,Atestado CBSM ocupação industrial
32.92-2-02,Fabricação de equipamentos e acessórios para segurança pessoal e profissional,Sim,Atestado CBSM ocupação industrial
32.99-0-01,Fabricação de guarda-chuvas e similares,Sim,Atestado CBSM ocupação industrial
32.99-0-02,"Fabricação de canetas, lápis e outros artigos para escritório",Sim,Atestado CBSM ocupação industrial
32.99-0-03,"Fabricação de letras, letreiros e placas de qualquer material, exceto luminosos",Sim,Atestado CBSM ocupação industrial
32.99-0-04,Fabricação de painéis e letreiros luminosos,Sim,Atestado CBSM ocupação industrial
32.99-0-05,Fabricação de aviamentos para costura,Sim,Atestado CBSM ocupação industrial
32.99-0-06,"Fabricação de velas, inclusive decorativas",Sim,Atestado CBSM ocupação industrial
32.99-0-99,Fabricação de produtos diversos não especificados anteriormente,Sim,Atestado CBSM ocupação industrial
32.50-7-06,Serviços de prótese dentária,Sim,-
32.50-7-09,Serviço de laboratório óptico,Não,-
33.11-2-00,"Manutenção e reparação de tanques, reservatórios metálicos e caldeiras, exceto para veículos",Sim,-
33.13-9-02,"Manutenção e reparação de baterias e acumuladores elétricos, exceto para veículos",Sim,-
33.14-7-05,Manutenção e reparação de equipamentos de transmissão para fins industriais,Sim,-
33.14-7-06,"Manutenção e reparação de máquinas, aparelhos e equipamentos para instalações térmicas",Sim,-
33.14-7-07,Manutenção e reparação de máquinas e aparelhos de refrigeração e ventilação para uso industrial e comercial,Sim,-
33.14-7-08,"Manutenção e reparação de máquinas, equipamentos e aparelhos para transporte e elevação de cargas",Sim,-
33.14-7-10,Manutenção e reparação de máquinas e equipamentos para uso geral não especificados anteriormente,Sim,-
33.14-7-11,Manutenção e reparação de máquinas e equipamentos para agricultura e pecuária,Sim,-
33.14-7-13,Manutenção e reparação de máquinas-ferramenta,Sim,-
33.14-7-14,Manutenção e reparação de máquinas e equipamentos para a prospecção e extração de petróleo,Sim,-
33.14-7-15,"Manutenção e reparação de máquinas e equipamentos para uso na extração mineral, exceto na extração de petróleo",Sim,-
33.14-7-17,"Manutenção e reparação de máquinas e equipamentos de terraplenagem, pavimentação e construção, exceto tratores",Sim,-
33.14-7-18,"Manutenção e reparação de máquinas para a indústria metalúrgica, exceto máquinas-ferramenta",Sim,-
33.14-7-19,"Manutenção e reparação de máquinas e equipamentos para as indústrias de alimentos, bebidas e fumo",Sim,-
33.14-7-20,"Manutenção e reparação de máquinas e equipamentos para a indústria têxtil, do vestuário, do couro e calçados",Sim,-
33.14-7-21,"Manutenção e reparação de máquinas e aparelhos para a indústria de celulose, papel e papelão e artefatos",Sim,-
33.14-7-22,Manutenção e reparação de máquinas e aparelhos para a indústria do plástico,Sim,-
33.14-7-99,Manutenção e reparação de outras máquinas e equipamentos para usos industriais não especificados anteriormente,Sim,-
